t,i,k,hs02_desc,section,section_name,v,share
2021,398,10110,"Horses, asses, mules and hinnies: live, pure-bred breeding animals",1,Live animals; animal products,6.765,1.251105512801554e-7
2021,398,10190,"Horses, asses, mules and hinnies: live, other than pure-bred breeding animals",1,Live animals; animal products,626.831,1.1592486617810954e-5
2021,398,10210,"Bovine animals: live, pure-bred breeding animals",1,Live animals; animal products,4720.993,8.730909635177455e-5
2021,398,10290,"Bovine animals: live, other than pure-bred breeding animals",1,Live animals; animal products,63690.46,0.0011778785752973669
2021,398,10410,Sheep: live,1,Live animals; animal products,16443.591,3.041044693326537e-4
2021,398,10420,Goats: live,1,Live animals; animal products,64.285,1.18887387864668e-6
2021,398,10511,"Poultry: live, fowls of the species gallus domesticus, weighing not more than 185g",1,Live animals; animal products,172.5,3.1901803541503044e-6
2021,398,10619,"Mammals: live, other than primates, whales, dolphins and porpoises (order Cetacea), manatees and dugongs (order Sirenia)",1,Live animals; animal products,157.353,2.9100547783571764e-6
2021,398,10631,"Animals: live, birds of prey",1,Live animals; animal products,16.819,3.110472079794433e-7
2021,398,10639,"Animals: live, birds, other than birds of prey and Psittaciformes",1,Live animals; animal products,168.019,3.1073096401390147e-6
2021,398,10690,"Animals: live, n.e.c. in chapter 01, other than mammals, reptiles and birds",1,Live animals; animal products,54.80500000000001,1.0135526626620722e-6
2021,398,20110,"Meat: of bovine animals, carcasses and half-carcasses, fresh or chilled",1,Live animals; animal products,289.835,5.360150277942919e-6
2021,398,20120,"Meat: of bovine animals, cuts with bone in (excluding carcasses and half-carcasses), fresh or chilled",1,Live animals; animal products,32884.106,6.081520517391082e-4
2021,398,20130,"Meat: of bovine animals, boneless cuts, fresh or chilled",1,Live animals; animal products,8440.778,1.5610205303967595e-4
2021,398,20220,"Meat: of bovine animals, cuts with bone in (excluding carcasses and half-carcasses), frozen",1,Live animals; animal products,2170.464,4.014012528806079e-5
2021,398,20230,"Meat: of bovine animals, boneless cuts, frozen",1,Live animals; animal products,3697.877,6.838779453602472e-5
2021,398,20322,"Meat: of swine, hams, shoulders and cuts thereof, with bone in, frozen",1,Live animals; animal products,21.44,3.965070538723625e-7
2021,398,20329,"Meat: of swine, n.e.s. in item no. 0203.2, frozen",1,Live animals; animal products,574.392,1.0622690283948417e-5
2021,398,20410,"Meat: of sheep, lamb carcasses and half-carcasses, fresh or chilled",1,Live animals; animal products,4579.955,8.470076790662295e-5
2021,398,20421,"Meat: of sheep, carcasses and half-carcasses (excluding carcasses and half-carcasses of lamb), fresh or chilled",1,Live animals; animal products,2329.773,4.308635393756416e-5
2021,398,20422,"Meat: of sheep (including lamb), cuts with bone in (excluding carcasses and half-carcasses), fresh or chilled",1,Live animals; animal products,709.877,1.3128322662395104e-5
2021,398,20442,"Meat: of sheep (including lamb), cuts with bone in (excluding carcasses and half-carcasses), frozen",1,Live animals; animal products,28.45,5.26148585945369e-7
2021,398,20443,"Meat: of sheep (including lamb), boneless cuts, frozen",1,Live animals; animal products,52.398,9.690380880972039e-7
2021,398,20450,"Meat: of goats, fresh, chilled or frozen",1,Live animals; animal products,56.859,1.0515389261254038e-6
2021,398,20610,"Offal, edible: of bovine animals, fresh or chilled",1,Live animals; animal products,67.029,1.239620863526613e-6
2021,398,20621,"Offal, edible: of bovine animals, tongues, frozen",1,Live animals; animal products,31.534,5.831834625378302e-7
2021,398,20622,"Offal, edible: of bovine animals, livers, frozen",1,Live animals; animal products,77.145,1.4267041357734797e-6
2021,398,20629,"Offal, edible: of bovine animals, (other than tongues and livers), frozen",1,Live animals; animal products,44.863,8.296873114680876e-7
2021,398,20649,"Offal, edible: of swine, (other than livers), frozen",1,Live animals; animal products,22.976,4.2491352937366604e-7
2021,398,20690,"Offal, edible: of sheep, goats, horses, asses, mules or hinnies, frozen",1,Live animals; animal products,13.471,2.4912996841019566e-7
2021,398,20711,"Meat and edible offal: of the poultry of heading no. 0105, of fowls of the species gallus domesticus, (not cut in pieces), fresh or chilled",1,Live animals; animal products,13016.244,2.4071980228189437e-4
2021,398,20712,"Meat and edible offal: of the poultry of heading no. 0105, of fowls of the species gallus domesticus, (not cut in pieces), frozen",1,Live animals; animal products,3160.1580000000004,5.8443327348469094e-5
2021,398,20713,"Meat and edible offal: of the poultry of heading no. 0105, of fowls of the species gallus domesticus, cuts and offal, fresh or chilled",1,Live animals; animal products,1778.8670000000002,3.289800902055821e-5
2021,398,20714,"Meat and edible offal: of the poultry of heading no. 0105, of fowls of the species gallus domesticus, cuts and offal, frozen",1,Live animals; animal products,7375.254,1.3639646618938232e-4
2021,398,20725,"Meat and edible offal: of the poultry of heading no. 0105, of turkeys, (not cut in pieces), frozen",1,Live animals; animal products,186.677,3.4523669447635732e-6
2021,398,20726,"Meat and edible offal: of the poultry of heading no. 0105, of turkeys, cuts and offal, fresh or chilled",1,Live animals; animal products,1913.078,3.538008029888206e-5
2021,398,20727,"Meat and edible offal: of the poultry of heading no. 0105, of turkeys, cuts and offal, frozen",1,Live animals; animal products,4161.3499999999995,7.695917111155576e-5
2021,398,20890,"Meat and edible meat offal: n.e.s. in chapter 2, fresh, chilled or frozen",1,Live animals; animal products,0.045,8.322209619522533e-10
2021,398,20900,"Fat: pig fat, free of lean meat, and poultry fat, (not rendered or otherwise extracted), fresh, chilled, frozen, salted, in brine, dried or smoked",1,Live animals; animal products,169.766,3.139618307261916e-6
2021,398,21011,"Meat, preserved: of swine, hams, shoulders and cuts thereof, with bone in, salted, in brine, dried or smoked",1,Live animals; animal products,93.84,1.7354581126577658e-6
2021,398,21020,"Meat, preserved: of bovine animals, salted, in brine, dried or smoked",1,Live animals; animal products,475.991,8.802881953347e-6
2021,398,21099,"Meat and edible meat offal, preserved: salted, in brine, dried or smoked, and edible flours and meals of meat or meat offal, other than of primates,whales, dolphins and porpoises, manatees and dugongs, reptiles (including snakes and turtles)",1,Live animals; animal products,0.795,1.4702570327823143e-8
2021,398,30191,"Fish: live, trout (salmo trutta, oncorhynchus mykiss, oncorhynchus clarki, oncorhynchus aguabonita, oncorhynchus gilae, oncorhynchus apache and oncorhynchus chrysogaster)",1,Live animals; animal products,12.714,2.3513016245024332e-7
2021,398,30199,"Fish: live, n.e.s. in heading no. 0301",1,Live animals; animal products,33.121,6.12533121796013e-7
2021,398,30211,"Fish: trout (salmo trutta, oncorhynchus mykiss, oncorhynchus clarki, oncorhynchus aguabonita, oncorhynchus gilae, oncorhynchus apache and oncorhynchus chrysogaster), fresh or chilled (excluding fillets, livers, roes, other fish meat of heading no. 0304)",1,Live animals; animal products,59.38,1.0981617937938845e-6
2021,398,30212,"Fish: Pacific salmon (oncorhynchus nerka/gorbuscha/keta/tschawytscha/kisutch/masou/rhodurus), Atlantic salmon (salmo salar), Danube salmon (hucho hucho), fresh or chilled (excluding fillets, livers, roes and other fish meat of heading no. 0304)",1,Live animals; animal products,19.032,3.519739855083397e-7
2021,398,30219,"Fish: salmonidae, fresh or chilled, n.e.s. in item no. 0302.1 (excluding fillets, livers, roes and other fish meat of heading no. 0304)",1,Live animals; animal products,4.285,7.924592937700902e-8
2021,398,30239,"Fish: tuna, fresh or chilled, n.e.s. in item no. 0302.3 (excluding fillets, livers, roes and other fish meat of heading no. 0304)",1,Live animals; animal products,2.316,4.28316388418093e-8
2021,398,30261,"Fish: sardines (sardina pilchardus, sardinops spp.), sardinella (sardinella spp.), brisling or sprats (sprattus sprattus), fresh or chilled (excluding fillets, livers, roes and other fish meat of heading no. 0304)",1,Live animals; animal products,0.721,1.3334029190390548e-8
2021,398,30269,"Fish: fresh or chilled, n.e.s. in heading no. 0302 (excluding fillets, livers, roes and other fish meat of heading no. 0304)",1,Live animals; animal products,556.859,1.0298438503372665e-5
2021,398,30270,"Fish: livers and roes, fresh or chilled",1,Live animals; animal products,6.204,1.1473552995448399e-7
2021,398,30321,"Fish: trout (salmo trutta, oncorhynchus mykiss, oncorhynchus clarki, oncorhynchus aguabonita, oncorhynchus gilae, oncorhynchus apache and oncorhynchus chrysogaster), frozen (excluding fillets, livers, roes and other fish meat of heading no. 0304)",1,Live animals; animal products,300.448,5.556424968369569e-6
2021,398,30322,"Fish: Atlantic salmon (salmo salar) and Danube salmon (hucho hucho), frozen (excluding fillets, livers, roes and other fish meat of heading no. 0304)",1,Live animals; animal products,78.209,1.4463815380738619e-6
2021,398,30329,"Fish: salmonidae, frozen, n.e.s. in item no. 0302.1 and 0302.2 (excluding fillets, livers, roes and other fish meat of heading no. 0304)",1,Live animals; animal products,6.022,1.11369658508366e-7
2021,398,30332,"Fish: plaice (pleuronectes platessa), frozen (excluding fillets, livers, roes and other fish meat of heading no. 0304)",1,Live animals; animal products,0.101,1.8678737146039465e-9
2021,398,30339,"Fish: flat fish, frozen, n.e.s. in item no. 0303.3 (excluding fillets, livers, roes and other fish meat of heading no. 0304)",1,Live animals; animal products,17.602,3.255278527174125e-7
2021,398,30350,"Fish: herrings (clupea harengus, clupea pallasii), frozen (excluding fillets, livers, roes and other fish meat of heading no. 0304)",1,Live animals; animal products,13.537,2.503505591543923e-7
2021,398,30371,"Fish: sardines (sardina pilchardus, sardinops spp.), sardinella (sardinella spp.), brisling or sprats (sprattus sprattus), frozen (excluding fillets, livers, roes and other fish meat of heading no. 0304)",1,Live animals; animal products,1.419,2.6242701000227722e-8
2021,398,30374,"Fish: mackerel (scomber scombrus, scomber australasicus, scomber japonicus), frozen (excluding fillets, livers, roes and other fish meat of heading no. 0304)",1,Live animals; animal products,144.432,2.6710963994819523e-6
2021,398,30379,"Fish: frozen, n.e.s. in heading no. 0303 (excluding fillets, livers, roes and other fish meat of heading no. 0304)",1,Live animals; animal products,10269.644999999999,1.8992475201795884e-4
2021,398,30380,"Fish: livers and roes, frozen",1,Live animals; animal products,187.57000000000002,3.468881907408537e-6
2021,398,30410,"Fish: fillets and other fish meat, fresh or chilled (whether or not minced)",1,Live animals; animal products,1366.346,2.526892849954697e-5
2021,398,30420,"Fish: fillets, frozen",1,Live animals; animal products,46310.233,8.564521478998441e-4
2021,398,30490,"Fish: fish meat n.e.s. in heading no. 0304 (whether or not minced), fresh, chilled or frozen",1,Live animals; animal products,741.6789999999999,1.3716462463106337e-5
2021,398,30510,Fish meal: fit for human consumption,1,Live animals; animal products,68.077,1.2590023650405233e-6
2021,398,30520,"Fish: livers and roes, dried, smoked (whether or not cooked before or during the smoking process), salted or in brine",1,Live animals; animal products,341.96000000000004,6.324139558870946e-6
2021,398,30530,"Fish: fillets, dried, salted or in brine, but not smoked",1,Live animals; animal products,822.245,1.5206433885787347e-5
2021,398,30549,"Fish: smoked (whether or not cooked before or during the smoking process), n.e.s. in item no. 0305.4 (including fillets)",1,Live animals; animal products,52.572,9.72256009150086e-7
2021,398,30551,"Fish: cod (gadus morhua, gadus ogac, gadus macrocephalus), dried (whether or not salted but not smoked)",1,Live animals; animal products,464.44599999999997,8.589371042108361e-6
2021,398,30559,"Fish: dried (whether or not salted but not smoked), n.e.s. in item no. 0305.51",1,Live animals; animal products,3759.3869999999997,6.952534812201769e-5
2021,398,30569,"Fish: salted or in brine, but not dried or smoked, n.e.s. in item no. 0305.6",1,Live animals; animal products,530.639,9.813531089541818e-6
2021,398,30613,"Crustaceans: shrimps and prawns, frozen (whether in shell or not, whether or not cooked by steaming or by boiling in water)",1,Live animals; animal products,1057.289,1.9553290414256354e-5
2021,398,30619,"Crustaceans: frozen, n.e.s. in item no. 0306.1 (whether in shell or not, whether or not cooked by steaming or by boiling in water)",1,Live animals; animal products,8.674,1.6041521386608545e-7
2021,398,40110,"Dairy produce: milk and cream, not concentrated, not containing added sugar or other sweetening matter, of a fat content not exceeding 1% (by weight)",1,Live animals; animal products,2.313,4.277615744434583e-8
2021,398,40120,"Dairy produce: milk and cream, not concentrated, not containing added sugar or other sweetening matter, of a fat content exceeding 1% but not exceeding 6% (by weight)",1,Live animals; animal products,13559.226000000002,2.5076160233440014e-4
2021,398,40130,"Dairy produce: milk and cream, not concentrated, not containing added sugar or other sweetening matter, of a fat content exceeding 6% (by weight)",1,Live animals; animal products,434.04600000000005,8.02715954781173e-6
2021,398,40210,"Dairy produce: milk and cream, concentrated or containing added sugar or other sweetening matter, in powder, granules or other solid forms, of a fat content not exceeding 1.5% (by weight)",1,Live animals; animal products,656.687,1.2144637485367543e-5
2021,398,40221,"Dairy produce: milk and cream, concentrated, not containing added sugar or other sweetening matter, in powder, granules or other solid forms, of a fat content exceeding 1.5% (by weight)",1,Live animals; animal products,3054.1319999999996,5.648250379931465e-5
2021,398,40291,"Dairy produce: milk and cream, concentrated, not containing added sugar or other sweetening matter, other than in powder, granules or other solid forms",1,Live animals; animal products,27.817,5.14442011080574e-7
2021,398,40299,"Dairy produce: milk and cream, containing added sugar or other sweetening matter, other than in powder, granules or other solid forms",1,Live animals; animal products,1748.5140000000001,3.233666673482183e-5
2021,398,40310,"Dairy produce: yoghurt, whether or not concentrated or containing added sugar or other sweetening matter or flavoured or containing added fruit or cocoa",1,Live animals; animal products,9565.801,1.769080024458628e-4
2021,398,40390,"Dairy produce: buttermilk, curdled milk or cream, kephir, fermented or acidified milk or cream, whether or not concentrated or containing added sweetening, flavouring, fruit or cocoa (excluding yoghurt)",1,Live animals; animal products,2566.265,4.745998948720887e-5
2021,398,40410,"Dairy produce: whey, whether or not concentrated or containing added sugar or other sweetening matter",1,Live animals; animal products,180.687,3.3415890878281515e-6
2021,398,40490,"Dairy produce: natural milk constituents (excluding whey), whether or not containing added sugar or other sweetening matter, n.e.s. in chapter 04",1,Live animals; animal products,38.195,7.063706587059182e-7
2021,398,40510,"Dairy produce: derived from milk, butter",1,Live animals; animal products,15480.121,2.8628624866127285e-4
2021,398,40520,Dairy produce: dairy spreads,1,Live animals; animal products,2.526,4.671533666425315e-8
2021,398,40590,Dairy produce: fats and oils derived from milk (other than butter or dairy spreads),1,Live animals; animal products,2190.026,4.050190098712101e-5
2021,398,40610,"Dairy produce: fresh cheese (including whey cheese), not fermented, and curd",1,Live animals; animal products,2191.342,4.052623882680833e-5
2021,398,40630,"Dairy produce: cheese, processed (not grated or powdered)",1,Live animals; animal products,97.085,1.7954704909141003e-6
2021,398,40640,"Dairy produce: cheese, blue-veined (not grated, powdered or processed)",1,Live animals; animal products,2.834,5.2411426803837465e-8
2021,398,40690,"Dairy produce: cheese (not grated, powdered or processed), n.e.s. in heading no. 0406",1,Live animals; animal products,9393.382,1.73719320089444e-4
2021,398,40700,"Eggs: birds' eggs, in the shell, fresh, preserved or cooked",1,Live animals; animal products,4078.669,7.5430085303663e-5
2021,398,40891,"Eggs: birds' eggs (not in shell, excluding yolks only), dried, whether or not containing added sugar or other sweetening matter",1,Live animals; animal products,470.637,8.703866152673837e-6
2021,398,40900,Honey: natural,1,Live animals; animal products,428.698,7.928254709933491e-6
2021,398,41000,"Animal products: edible, n.e.s. in this or other chapters",1,Live animals; animal products,2.202,4.072334573819693e-8
2021,398,50400,"Animal products: guts, bladders and stomachs of animals (other than fish), whole and pieces thereof, fresh, chilled, frozen, salted, in brine, dried or smoked",1,Live animals; animal products,1037.437,1.918615151344133e-5
2021,398,50510,"Animal products: feathers and down used for stuffing, not further worked than cleaned, disinfected or treated for preservation",1,Live animals; animal products,189.104,3.497251395311532e-6
2021,398,50790,"Animal products: tortoise-shell, whalebone and whalebone hair, horns, antlers, hooves, nails, claws and beaks, unworked or simply prepared but not cut to shape, waste and powder of these products",1,Live animals; animal products,672.7169999999999,1.2441093085814086e-5
2021,398,51000,"Animal products: ambergris, castoreum, civet, musk, cantharides, bile (dried or not) glands and other animal products, for pharmaceutical purposes, fresh, chilled, frozen or otherwise provisionally preserved",1,Live animals; animal products,17099.872,3.162415983355645e-4
2021,398,51191,"Animal products: of fish or crustaceans, molluscs or other aquatic invertebrates and dead animals of chapter 3, unfit for human consumption",1,Live animals; animal products,3347.1440000000002,6.190140887717141e-5
2021,398,51199,Animal products: n.e.s. in chapter 5,1,Live animals; animal products,1690.9160000000002,3.127146089112126e-5
2021,398,60110,"Plants, live: bulbs, tubers, tuberous roots, corms, crowns and rhizomes, dormant",2,Vegetable products,0.051000000000000004,9.431837568792205e-10
2021,398,60120,"Plants, live: bulbs, tubers, tuberous roots, corms, crowns and rhizomes, in growth or in flower, chicory plants and roots other than of heading no. 1212",2,Vegetable products,53.812,9.95188320101659e-7
2021,398,60210,"Plants, live: unrooted cuttings and slips",2,Vegetable products,574.451,1.0623781418098532e-5
2021,398,60220,"Plants, live: edible fruit or nut trees, shrubs and bushes, grafted or not",2,Vegetable products,3.848,7.11641391464949e-8
2021,398,60230,"Plants, live: rhododendrons and azaleas, grafted or not",2,Vegetable products,6.894,1.2749625137108522e-7
2021,398,60240,"Plants, live: roses, grafted or not",2,Vegetable products,36.327,6.718242418853224e-7
2021,398,60290,"Plants, live: n.e.s. in heading no. 0602",2,Vegetable products,66.13199999999999,1.2230319256850314e-6
2021,398,60310,"Flowers, cut: flowers, buds of a kind suitable for bouquets or for ornamental purposes, fresh",2,Vegetable products,2410.0679999999998,4.457131354067429e-5
2021,398,60390,Flowers: n.e.s. in heading no. 0603,2,Vegetable products,7.094,1.3119501120198413e-7
2021,398,60491,"Foliage, branches and other parts of plants, without flowers or flower buds, and grasses: being goods of a kind suitable for bouquets or for ornamental purposes, fresh",2,Vegetable products,28.788,5.323994900595882e-7
2021,398,60499,"Foliage, branches and other parts of plants, without flowers or flower buds, and grasses: kind suitable for bouquets or for ornamental purposes dried, dyed, bleached, impregnated, otherwise prepared, excluding fresh",2,Vegetable products,0.629,1.1632599668177052e-8
2021,398,70190,"Vegetables: potatoes (other than seed), fresh or chilled",2,Vegetable products,20323.4,3.7585687773645393e-4
2021,398,70200,"Vegetables: tomatoes, fresh or chilled",2,Vegetable products,15622.731,2.889236493586953e-4
2021,398,70310,"Vegetables, alliaceous: onions and shallots, fresh or chilled",2,Vegetable products,9474.312,1.7521602325501728e-4
2021,398,70320,"Vegetables, alliaceous: garlic, fresh or chilled",2,Vegetable products,37.922,7.013218515367411e-7
2021,398,70390,"Vegetables, alliaceous: leeks and other kinds n.e.s. in heading no. 0703, fresh or chilled",2,Vegetable products,50.663000000000004,9.369513465641559e-7
2021,398,70410,"Vegetables, brassica: cauliflowers and headed broccoli, fresh or chilled",2,Vegetable products,96.91999999999999,1.7924190140536086e-6
2021,398,70490,"Vegetables, brassica: edible, n.e.s. in heading no. 0704, fresh or chilled",2,Vegetable products,2214.0710000000004,4.094658438779084e-5
2021,398,70511,"Vegetables: cabbage (head) lettuce (lactuca sativa), fresh or chilled",2,Vegetable products,29.554,5.465657402119309e-7
2021,398,70519,"Vegetables: lettuce (lactuca sativa), (other than cabbage lettuce), fresh or chilled",2,Vegetable products,4.668,8.632905445318042e-8
2021,398,70529,"Vegetables: chicory (cichorium spp.), (other than witloof chicory), fresh or chilled",2,Vegetable products,2.407,4.451457456486831e-8
2021,398,70610,"Vegetables, root: carrots and turnips, fresh or chilled",2,Vegetable products,735.544,1.3603003005293515e-5
2021,398,70690,"Vegetables, root: salad beetroot, salsify, celeric, radishes and similar edible roots, fresh or chilled",2,Vegetable products,398.579,7.371239973199271e-6
2021,398,70700,"Vegetables: cucumbers and gherkins, fresh or chilled",2,Vegetable products,3122.163,5.774065544959407e-5
2021,398,70810,"Vegetables, leguminous: peas (pisum sativum), shelled or unshelled, fresh or chilled",2,Vegetable products,3.598,6.654068935787127e-8
2021,398,70820,"Vegetables, leguminous: beans (vigna spp., phaseolus spp.), shelled or unshelled, fresh or chilled",2,Vegetable products,0.144,2.6631070782472106e-9
2021,398,70920,"Vegetables: asparagus, fresh or chilled",2,Vegetable products,0.024,4.4385117970786846e-10
2021,398,70930,"Vegetables: aubergines, (egg plants), fresh or chilled",2,Vegetable products,106.867,1.976376834243366e-6
2021,398,70940,"Vegetables: celery (other than celeriac), fresh or chilled",2,Vegetable products,1.156,2.137883182259566e-8
2021,398,70960,Vegetables: fruits of the genus capsicum or of the genus pimenta,2,Vegetable products,420.836,7.782856460980855e-6
2021,398,70970,"Vegetables: spinach, New Zealand spinach and orache spinach (garden spinach), fresh or chilled",2,Vegetable products,0.007,1.2945659408146165e-10
2021,398,70990,"Vegetables: edible, n.e.s. in chapter 7, fresh or chilled",2,Vegetable products,403.26000000000005,7.457809447041461e-6
2021,398,71021,"Vegetables, leguminous: peas (pisum sativum), shelled or unshelled, uncooked or cooked by steaming or boiling in water, frozen",2,Vegetable products,1.668,3.0847656989696856e-8
2021,398,71022,"Vegetables, leguminous: beans (vigna spp., phaseolus spp.), shelled or unshelled, uncooked or cooked by steaming or boiling in water, frozen",2,Vegetable products,2.995,5.5388928467711083e-8
2021,398,71030,"Vegetables: spinach, New Zealand spinach and orache spinach (garden spinach), uncooked or cooked by steaming or boiling in water, frozen",2,Vegetable products,10.412,1.9255743679659694e-7
2021,398,71080,"Vegetables: uncooked or cooked by steaming or boiling in water, frozen, n.e.s. in chapter 7",2,Vegetable products,105.862,1.9577905660930987e-6
2021,398,71090,"Vegetable mixtures: uncooked or cooked by steaming or boiling in water, frozen",2,Vegetable products,10.561,1.953130128706166e-7
2021,398,71159,"Vegetables: mushrooms other than of the genus Agaricus, provisionally preserved but unsuitable in that state for immediate consumption",2,Vegetable products,0.666,1.2316870236893351e-8
2021,398,71190,"Vegetables and mixed vegetables: n.e.s. in heading no. 0711, provisionally preserved but unsuitable in that state for immediate consumption",2,Vegetable products,256.148,4.737149665825462e-6
2021,398,71220,"Vegetables: onions, whole, cut, sliced, broken or in powder but not further prepared, dried",2,Vegetable products,0.155,2.8665388689466505e-9
2021,398,71239,"Vegetables: mushrooms, other than the genus Agaricus and truffles, whole, cut, sliced, broken or in powder but not further prepared, dried",2,Vegetable products,90.94800000000001,1.6819740455029677e-6
2021,398,71290,"Vegetables: mixtures of vegetables n.e.s. in heading no. 0712, whole, cut, sliced, broken or in powder but not further prepared, dried",2,Vegetable products,132.13400000000001,2.443659657479979e-6
2021,398,71310,"Vegetables, leguminous: peas (pisum sativum), shelled, whether or not skinned or split, dried",2,Vegetable products,13072.770000000002,2.4176518277290135e-4
2021,398,71320,"Vegetables, leguminous: chickpeas (garbanzos), shelled, whether or not skinned or split, dried",2,Vegetable products,5307.51,9.81560239504712e-5
2021,398,71331,"Vegetables, leguminous: beans of the species vigna mungo (l.) hepper or vigna radiata (l.) wilczek, dried, shelled, whether or not skinned or split",2,Vegetable products,42.019,7.770909466727051e-7
2021,398,71332,"Vegetables, leguminous: small red (adzuki) beans (phaseolus or vigna angularis), shelled, dried, whether or not skinned or split",2,Vegetable products,0.276,5.1042885666404874e-9
