2021,398,846420,"Machine-tools: grinding or polishing machines, for working stone, ceramics, concrete, asbestos-cement or like mineral materials or for cold working glass",16,"Machinery and mechanical appliances; electrical equipment; parts thereof; sound recorders and reproducers, television image and sound recorders and reproducers, and parts and accessories of such articles",3.675,6.796471189276735e-8
2021,398,846490,"Machine-tools: for working stone, ceramics, concrete, asbestos-cement or like mineral materials or for cold working glass, (other than sawing, grinding or polishing machines)",16,"Machinery and mechanical appliances; electrical equipment; parts thereof; sound recorders and reproducers, television image and sound recorders and reproducers, and parts and accessories of such articles",14.756,2.7289450032372114e-7
2021,398,846510,"Machine-tools: which can carry out different types of machining operations without tool change between such operations, for working wood, cork, bone, hard rubber, hard plastics or similar",16,"Machinery and mechanical appliances; electrical equipment; parts thereof; sound recorders and reproducers, television image and sound recorders and reproducers, and parts and accessories of such articles",0.842,1.5571778888084383e-8
2021,398,846591,"Machine-tools: sawing machines, for working wood, cork, bone, hard rubber, hard plastics or similar hard materials",16,"Machinery and mechanical appliances; electrical equipment; parts thereof; sound recorders and reproducers, television image and sound recorders and reproducers, and parts and accessories of such articles",297.91600000000005,5.50959866891039e-6
2021,398,846592,"Machine-tools: planing, milling or moulding (by cutting) machines, for working wood, cork, bone, hard rubber, hard plastics or similar hard materials",16,"Machinery and mechanical appliances; electrical equipment; parts thereof; sound recorders and reproducers, television image and sound recorders and reproducers, and parts and accessories of such articles",24.41,4.514336373612112e-7
2021,398,846594,"Machine-tools: bending or assembling machines, for working wood, cork, bone, hard rubber, hard plastics or similar hard materials",16,"Machinery and mechanical appliances; electrical equipment; parts thereof; sound recorders and reproducers, television image and sound recorders and reproducers, and parts and accessories of such articles",7.9030000000000005,1.461564947179702e-7
2021,398,846595,"Machine-tools: drilling or morticing machines, for working wood, cork, bone, hard rubber, hard plastics or similar hard materials",16,"Machinery and mechanical appliances; electrical equipment; parts thereof; sound recorders and reproducers, television image and sound recorders and reproducers, and parts and accessories of such articles",32.211,5.957037645654229e-7
2021,398,846599,"Machine-tools: n.e.s. in heading no. 8465, for working wood, cork, bone, hard rubber, hard plastics or similar hard materials",16,"Machinery and mechanical appliances; electrical equipment; parts thereof; sound recorders and reproducers, television image and sound recorders and reproducers, and parts and accessories of such articles",1.291,2.3875494708452424e-8
2021,398,846610,"Machine-tools: parts and accessories, tool holders and self-opening dieheads",16,"Machinery and mechanical appliances; electrical equipment; parts thereof; sound recorders and reproducers, television image and sound recorders and reproducers, and parts and accessories of such articles",25.491,4.714254342472198e-7
2021,398,846620,"Machine-tools: parts and accessories, work holders",16,"Machinery and mechanical appliances; electrical equipment; parts thereof; sound recorders and reproducers, television image and sound recorders and reproducers, and parts and accessories of such articles",271.34000000000003,5.018107462580543e-6
2021,398,846630,"Machine-tools: parts and accessories, dividing heads and other special attachments for machine-tools",16,"Machinery and mechanical appliances; electrical equipment; parts thereof; sound recorders and reproducers, television image and sound recorders and reproducers, and parts and accessories of such articles",10.036999999999999,1.8562226211366146e-7
2021,398,846692,"Machine-tools: parts and accessories, for the machines of heading no. 8465",16,"Machinery and mechanical appliances; electrical equipment; parts thereof; sound recorders and reproducers, television image and sound recorders and reproducers, and parts and accessories of such articles",1.8139999999999998,3.3547751666253055e-8
2021,398,846693,"Machine-tools: parts and accessories, for the machines of heading no. 8456 to 8461",16,"Machinery and mechanical appliances; electrical equipment; parts thereof; sound recorders and reproducers, television image and sound recorders and reproducers, and parts and accessories of such articles",1738.775,3.215655562485621e-5
2021,398,846694,"Machine-tools: parts and accessories, of the machines of heading no. 8462 or 8463",16,"Machinery and mechanical appliances; electrical equipment; parts thereof; sound recorders and reproducers, television image and sound recorders and reproducers, and parts and accessories of such articles",38.751,7.166532110358171e-7
2021,398,846711,"Tools: for working in the hand, pneumatic, rotary type (including combined rotary-percussion)",16,"Machinery and mechanical appliances; electrical equipment; parts thereof; sound recorders and reproducers, television image and sound recorders and reproducers, and parts and accessories of such articles",66.163,1.2236052334588209e-6
2021,398,846719,"Tools: for working in the hand, pneumatic, other than rotary type",16,"Machinery and mechanical appliances; electrical equipment; parts thereof; sound recorders and reproducers, television image and sound recorders and reproducers, and parts and accessories of such articles",25.68,4.749207622874192e-7
2021,398,846721,"Tools: for working in the hand, with self-contained electric motor: drills of all kinds",16,"Machinery and mechanical appliances; electrical equipment; parts thereof; sound recorders and reproducers, television image and sound recorders and reproducers, and parts and accessories of such articles",1110.304,2.0533739176431884e-5
2021,398,846722,"Tools: for working in the hand, with self-contained electric motor: saws",16,"Machinery and mechanical appliances; electrical equipment; parts thereof; sound recorders and reproducers, television image and sound recorders and reproducers, and parts and accessories of such articles",174.421,3.2257069423260885e-6
2021,398,846729,"Tools: for working in the hand, with self-contained electric motor: other than saws and drills",16,"Machinery and mechanical appliances; electrical equipment; parts thereof; sound recorders and reproducers, television image and sound recorders and reproducers, and parts and accessories of such articles",636.483,1.1770988767250133e-5
2021,398,846781,"Tools: for working in the hand, chain saws with self-contained non-electric motor",16,"Machinery and mechanical appliances; electrical equipment; parts thereof; sound recorders and reproducers, television image and sound recorders and reproducers, and parts and accessories of such articles",43.899,8.11859289083155e-7
2021,398,846789,"Tools: for working in the hand, (other than chain saws), hydraulic or with self-contained non-electric motor, (not pneumatic)",16,"Machinery and mechanical appliances; electrical equipment; parts thereof; sound recorders and reproducers, television image and sound recorders and reproducers, and parts and accessories of such articles",94.098,1.7402295128396252e-6
2021,398,846791,"Tools: for working in the hand, parts of chain saws, with self-contained non-electric motor",16,"Machinery and mechanical appliances; electrical equipment; parts thereof; sound recorders and reproducers, television image and sound recorders and reproducers, and parts and accessories of such articles",1.288,2.3820013310988942e-8
2021,398,846792,"Tools: for working in the hand, parts of pneumatic tools",16,"Machinery and mechanical appliances; electrical equipment; parts thereof; sound recorders and reproducers, television image and sound recorders and reproducers, and parts and accessories of such articles",14.697999999999999,2.718218599727604e-7
2021,398,846799,"Tools: for working in the hand, parts thereof for other than chain saws and pneumatic tools",16,"Machinery and mechanical appliances; electrical equipment; parts thereof; sound recorders and reproducers, television image and sound recorders and reproducers, and parts and accessories of such articles",60.708,1.1227215590710532e-6
2021,398,846810,"Machinery and apparatus: hand-held blow pipes for soldering, brazing or welding, whether or not capable of cutting",16,"Machinery and mechanical appliances; electrical equipment; parts thereof; sound recorders and reproducers, television image and sound recorders and reproducers, and parts and accessories of such articles",0.373,6.8981870846264555e-9
2021,398,846820,"Machinery and apparatus: gas operated machinery and apparatus n.e.s. in item no. 8468.10, for soldering, brazing or welding, whether or not capable of cutting",16,"Machinery and mechanical appliances; electrical equipment; parts thereof; sound recorders and reproducers, television image and sound recorders and reproducers, and parts and accessories of such articles",2.492,4.608654749300034e-8
2021,398,846880,"Machinery and apparatus: for soldering, brazing or welding, whether or not capable of cutting, n.e.s. in heading no. 8468",16,"Machinery and mechanical appliances; electrical equipment; parts thereof; sound recorders and reproducers, television image and sound recorders and reproducers, and parts and accessories of such articles",0.34,6.287891712528137e-9
2021,398,846890,"Machinery and apparatus: parts, soldering, brazing or welding, whether or not capable of cutting, parts thereof",16,"Machinery and mechanical appliances; electrical equipment; parts thereof; sound recorders and reproducers, television image and sound recorders and reproducers, and parts and accessories of such articles",3.39,6.269397913373643e-8
2021,398,847010,"Calculating machines: electronic calculators capable of operation without an external source of electric power and pocket-size data recording, reproducing and displaying machines with calculating functions",16,"Machinery and mechanical appliances; electrical equipment; parts thereof; sound recorders and reproducers, television image and sound recorders and reproducers, and parts and accessories of such articles",0.559,1.0338033727362437e-8
2021,398,847050,Cash registers,16,"Machinery and mechanical appliances; electrical equipment; parts thereof; sound recorders and reproducers, television image and sound recorders and reproducers, and parts and accessories of such articles",378.62800000000004,7.002270186267951e-6
2021,398,847090,"Postage-franking machines, ticket-issuing machines which print tickets",16,"Machinery and mechanical appliances; electrical equipment; parts thereof; sound recorders and reproducers, television image and sound recorders and reproducers, and parts and accessories of such articles",176.70499999999998,3.267946779594954e-6
2021,398,847130,"Data processing machines: portable, digital and automatic, weighing not more than 10kg, consisting of at least a central processing unit, a keyboard and a display",16,"Machinery and mechanical appliances; electrical equipment; parts thereof; sound recorders and reproducers, television image and sound recorders and reproducers, and parts and accessories of such articles",4200.656000000001,7.768608838112234e-5
2021,398,847141,"Data processing machines: digital, automatic, (not portable, analogue or hybrid), comprising in the same housing at least a central processing unit, an input and output unit, whether or not combined",16,"Machinery and mechanical appliances; electrical equipment; parts thereof; sound recorders and reproducers, television image and sound recorders and reproducers, and parts and accessories of such articles",655.985,1.2131654838361087e-5
2021,398,847149,"Data processing machines: digital, automatic, (not portable, analogue or hybrid), presented in the form of systems, n.e.s. in item no. 8471.41",16,"Machinery and mechanical appliances; electrical equipment; parts thereof; sound recorders and reproducers, television image and sound recorders and reproducers, and parts and accessories of such articles",150.382,2.7811345044511947e-6
2021,398,847150,"Digital processing units: other than those of subheadings 8471.41 or 8471.49, whether or not containing in the same housing one or two of the following types of unit: storage units, input units or output units",16,"Machinery and mechanical appliances; electrical equipment; parts thereof; sound recorders and reproducers, television image and sound recorders and reproducers, and parts and accessories of such articles",1058.4420000000002,1.9574613764681493e-5
2021,398,847160,"Data processing machines: input or output units, whether or not containing storage units in the same housing",16,"Machinery and mechanical appliances; electrical equipment; parts thereof; sound recorders and reproducers, television image and sound recorders and reproducers, and parts and accessories of such articles",2283.568,4.223184794763074e-5
2021,398,847170,Data processing machines: storage units,16,"Machinery and mechanical appliances; electrical equipment; parts thereof; sound recorders and reproducers, television image and sound recorders and reproducers, and parts and accessories of such articles",332.39700000000005,6.147283357556515e-6
2021,398,847180,"Data processing machines: automatic, units thereof n.e.s. in heading no. 8471",16,"Machinery and mechanical appliances; electrical equipment; parts thereof; sound recorders and reproducers, television image and sound recorders and reproducers, and parts and accessories of such articles",92.06000000000002,1.7025391501627658e-6
2021,398,847190,Data processing machines: n.e.s. in heading no. 8471,16,"Machinery and mechanical appliances; electrical equipment; parts thereof; sound recorders and reproducers, television image and sound recorders and reproducers, and parts and accessories of such articles",214.671,3.970082358294493e-6
2021,398,847290,"Office machines: automatic banknote dispensers, coin-sorting machines, coin-counting or wrapping machines, pencil-sharpening machines, perforating or stapling machines",16,"Machinery and mechanical appliances; electrical equipment; parts thereof; sound recorders and reproducers, television image and sound recorders and reproducers, and parts and accessories of such articles",1563.8560000000002,2.8921638770551183e-5
2021,398,847321,"Calculating machines: parts and accessories of item no. 8470.10, 8470.21 or 8470.29",16,"Machinery and mechanical appliances; electrical equipment; parts thereof; sound recorders and reproducers, television image and sound recorders and reproducers, and parts and accessories of such articles",0.01,1.8493799154494519e-10
2021,398,847329,"Machines: parts and accessories of heading no. 8470, (not of 8470.10, 8470.21 or 8470.29)",16,"Machinery and mechanical appliances; electrical equipment; parts thereof; sound recorders and reproducers, television image and sound recorders and reproducers, and parts and accessories of such articles",38.885999999999996,7.191498739216738e-7
2021,398,847330,"Machines: parts and accessories of automatic data processing, magnetic or optical readers, digital processing units",16,"Machinery and mechanical appliances; electrical equipment; parts thereof; sound recorders and reproducers, television image and sound recorders and reproducers, and parts and accessories of such articles",1108.617,2.050254013725825e-5
2021,398,847340,"Machines: parts and accessories, of heading no. 8472",16,"Machinery and mechanical appliances; electrical equipment; parts thereof; sound recorders and reproducers, television image and sound recorders and reproducers, and parts and accessories of such articles",92.537,1.7113606923594594e-6
2021,398,847350,Machines: parts and accessories equally suitable for use with machines of two or more of heading no. 8469 to 8472,16,"Machinery and mechanical appliances; electrical equipment; parts thereof; sound recorders and reproducers, television image and sound recorders and reproducers, and parts and accessories of such articles",11.723,2.1680280748813926e-7
2021,398,847410,"Machines: for sorting, screening, separating or washing earth, stone, ores or other mineral substances",16,"Machinery and mechanical appliances; electrical equipment; parts thereof; sound recorders and reproducers, television image and sound recorders and reproducers, and parts and accessories of such articles",208.535,3.856604406682514e-6
2021,398,847420,"Machines: for crushing or grinding earth, stone, ores or other mineral substances",16,"Machinery and mechanical appliances; electrical equipment; parts thereof; sound recorders and reproducers, television image and sound recorders and reproducers, and parts and accessories of such articles",127.393,2.3559805556885203e-6
2021,398,847431,Machines: concrete or mortar mixers,16,"Machinery and mechanical appliances; electrical equipment; parts thereof; sound recorders and reproducers, television image and sound recorders and reproducers, and parts and accessories of such articles",114.018,2.108625991997156e-6
2021,398,847432,Machines: for mixing mineral substances with bitumen,16,"Machinery and mechanical appliances; electrical equipment; parts thereof; sound recorders and reproducers, television image and sound recorders and reproducers, and parts and accessories of such articles",2324.172,4.298277016849983e-5
2021,398,847439,"Machines: for mixing or kneading mineral substances, excluding concrete mixers and machines for mixing mineral substances with bitumen",16,"Machinery and mechanical appliances; electrical equipment; parts thereof; sound recorders and reproducers, television image and sound recorders and reproducers, and parts and accessories of such articles",15.094000000000001,2.791454044379403e-7
2021,398,847480,"Machines: for agglomerating, shaping or moulding solid mineral fuels, ceramic paste, unhardened cements, plastering materials in powder or paste form, machines for forming foundry moulds of sand",16,"Machinery and mechanical appliances; electrical equipment; parts thereof; sound recorders and reproducers, television image and sound recorders and reproducers, and parts and accessories of such articles",160.04199999999997,2.9597846042836113e-6
2021,398,847490,"Machines, for sorting, screening, separating, washing, crushing etc mineral substances, for agglomerating, shaping or moulding solid fuels, ceramic pastes etc, for forming foundry moulds of sand: parts",16,"Machinery and mechanical appliances; electrical equipment; parts thereof; sound recorders and reproducers, television image and sound recorders and reproducers, and parts and accessories of such articles",4848.331999999999,8.966407824230871e-5
2021,398,847689,"Machines: automatic goods-vending machines, (eg postage stamp, cigarette, food or money-changing machines, excluding beverage-vending machines), not incorporating heating or refrigerating devices",16,"Machinery and mechanical appliances; electrical equipment; parts thereof; sound recorders and reproducers, television image and sound recorders and reproducers, and parts and accessories of such articles",1.575,2.9127733668328866e-8
2021,398,847690,Machines: parts of automatic goods-vending machines,16,"Machinery and mechanical appliances; electrical equipment; parts thereof; sound recorders and reproducers, television image and sound recorders and reproducers, and parts and accessories of such articles",11.069,2.0470786284109984e-7
2021,398,847710,"Machinery: injection moulding, for rubber or plastics",16,"Machinery and mechanical appliances; electrical equipment; parts thereof; sound recorders and reproducers, television image and sound recorders and reproducers, and parts and accessories of such articles",355.639,6.577116237505277e-6
2021,398,847720,"Machinery: extruding, for rubber or plastics",16,"Machinery and mechanical appliances; electrical equipment; parts thereof; sound recorders and reproducers, television image and sound recorders and reproducers, and parts and accessories of such articles",763.62,1.4122234910355104e-5
2021,398,847730,"Machinery: blow moulding, for rubber or plastics",16,"Machinery and mechanical appliances; electrical equipment; parts thereof; sound recorders and reproducers, television image and sound recorders and reproducers, and parts and accessories of such articles",26.02,4.812086539999474e-7
2021,398,847740,Machinery: vacuum moulding and other thermoforming machines for rubber or plastics,16,"Machinery and mechanical appliances; electrical equipment; parts thereof; sound recorders and reproducers, television image and sound recorders and reproducers, and parts and accessories of such articles",14.162,2.619091836259514e-7
2021,398,847759,"Machinery: for moulding or forming, other than for moulding or retreading pneumatic tyres or for moulding or otherwise forming inner tubes",16,"Machinery and mechanical appliances; electrical equipment; parts thereof; sound recorders and reproducers, television image and sound recorders and reproducers, and parts and accessories of such articles",1038.079,1.9198024532498515e-5
2021,398,847780,Machinery: for working rubber or plastics n.e.s. in heading no. 8477,16,"Machinery and mechanical appliances; electrical equipment; parts thereof; sound recorders and reproducers, television image and sound recorders and reproducers, and parts and accessories of such articles",1433.002,2.6501651175988954e-5
2021,398,847790,Machinery: parts of those for working rubber or plastics,16,"Machinery and mechanical appliances; electrical equipment; parts thereof; sound recorders and reproducers, television image and sound recorders and reproducers, and parts and accessories of such articles",116.351,2.1517720254245917e-6
2021,398,847810,"Machinery: for preparing or making up tobacco, n.e.s. in this chapter",16,"Machinery and mechanical appliances; electrical equipment; parts thereof; sound recorders and reproducers, television image and sound recorders and reproducers, and parts and accessories of such articles",2005.02,3.70804371807446e-5
2021,398,847890,"Machinery: parts of those for preparing or making up tobacco, n.e.s. in this chapter",16,"Machinery and mechanical appliances; electrical equipment; parts thereof; sound recorders and reproducers, television image and sound recorders and reproducers, and parts and accessories of such articles",1.143,2.1138412433587235e-8
2021,398,847910,"Machinery and mechanical appliances: for public works, building or the like",16,"Machinery and mechanical appliances; electrical equipment; parts thereof; sound recorders and reproducers, television image and sound recorders and reproducers, and parts and accessories of such articles",944.159,1.746108691590839e-5
2021,398,847920,Machinery: for the extraction or preparation of animal or fixed vegetable fats or oils,16,"Machinery and mechanical appliances; electrical equipment; parts thereof; sound recorders and reproducers, television image and sound recorders and reproducers, and parts and accessories of such articles",171.427,3.1703365076575317e-6
2021,398,847930,Machinery and mechanical appliances: presses for the manufacture of particle or fibre building board of wood or other ligneous materials and other machinery for treating wood or cork,16,"Machinery and mechanical appliances; electrical equipment; parts thereof; sound recorders and reproducers, television image and sound recorders and reproducers, and parts and accessories of such articles",42.399,7.841185903514131e-7
2021,398,847960,Machinery and mechanical appliances: evaporative air coolers,16,"Machinery and mechanical appliances; electrical equipment; parts thereof; sound recorders and reproducers, television image and sound recorders and reproducers, and parts and accessories of such articles",12.505,2.3126495842695398e-7
2021,398,847981,"Machines and mechanical appliances: for treating metal, including electric wire coil-winders",16,"Machinery and mechanical appliances; electrical equipment; parts thereof; sound recorders and reproducers, television image and sound recorders and reproducers, and parts and accessories of such articles",359.71,6.652404493863223e-6
2021,398,847982,"Machines: for mixing, kneading, crushing, grinding, screening, sifting, homogenising, emulsifying or stirring",16,"Machinery and mechanical appliances; electrical equipment; parts thereof; sound recorders and reproducers, television image and sound recorders and reproducers, and parts and accessories of such articles",511.17499999999995,9.453567782798734e-6
2021,398,847989,"Machines and mechanical appliances: n.e.s. in item no. 8479.8, having individual functions",16,"Machinery and mechanical appliances; electrical equipment; parts thereof; sound recorders and reproducers, television image and sound recorders and reproducers, and parts and accessories of such articles",3836.666,7.095453042687787e-5
2021,398,847990,"Machines and mechanical appliances: parts, of those having individual functions",16,"Machinery and mechanical appliances; electrical equipment; parts thereof; sound recorders and reproducers, television image and sound recorders and reproducers, and parts and accessories of such articles",460.83899999999994,8.522663908558098e-6
