2021,398,390810,"Polyamides: polyamide-6, -11, -12, -6,6, -6,9, -6,10 or -6,12, in primary forms",7,Plastics and articles thereof; rubber and articles thereof,0.552,1.0208577133280975e-8
2021,398,390890,"Polyamides: n.e.s. in heading no. 3908, in primary forms",7,Plastics and articles thereof; rubber and articles thereof,12.604000000000001,2.3309584454324892e-7
2021,398,390910,"Amino-resins: urea and thiourea resins, in primary forms",7,Plastics and articles thereof; rubber and articles thereof,568.115,1.0506604706655654e-5
2021,398,390930,"Amino-resins: n.e.s. in heading no. 3909, in primary forms",7,Plastics and articles thereof; rubber and articles thereof,1154.079,2.1343305234419878e-5
2021,398,390940,Phenolic resins: in primary forms,7,Plastics and articles thereof; rubber and articles thereof,14.706999999999999,2.7198830416515086e-7
2021,398,390950,Polyurethanes: in primary forms,7,Plastics and articles thereof; rubber and articles thereof,566.384,1.0474591940319223e-5
2021,398,391000,Silicones: in primary forms,7,Plastics and articles thereof; rubber and articles thereof,71.29299999999999,1.3184784231213776e-6
2021,398,391110,"Petroleum resins, coumarone, indene or coumarone-indene resins and polyterpenes: in primary forms",7,Plastics and articles thereof; rubber and articles thereof,1.08,1.997330308685408e-8
2021,398,391190,"Polysulphides, polysulphones and similar products of chemical synthesis n.e.s. in chapter 39: in primary forms",7,Plastics and articles thereof; rubber and articles thereof,6.942,1.2838395373050094e-7
2021,398,391231,"Cellulose ethers: carboxymethylcellulose and its salts, in primary forms",7,Plastics and articles thereof; rubber and articles thereof,446.08500000000004,8.249806395832687e-6
2021,398,391239,"Cellulose ethers: (other than carboxymethylcellulose and its salts), in primary forms",7,Plastics and articles thereof; rubber and articles thereof,237.369,4.3898546115032095e-6
2021,398,391290,"Cellulose and its chemical derivatives: n.e.s. in item no. 3912, in primary forms",7,Plastics and articles thereof; rubber and articles thereof,4.949,9.152581201559338e-8
2021,398,391390,"Polymers, natural and modified natural: in primary forms (excluding alginic acid, its salts and esters)",7,Plastics and articles thereof; rubber and articles thereof,75.006,1.3871458993820159e-6
2021,398,391400,"Ion-exchangers: based on polymers of heading no. 3901 to 3913, in primary forms",7,Plastics and articles thereof; rubber and articles thereof,120.929,2.2364366379538676e-6
2021,398,391510,"Ethylene polymers: waste, parings and scrap",7,Plastics and articles thereof; rubber and articles thereof,531.567,9.830693335157188e-6
2021,398,391520,"Styrene polymers: waste, parings and scrap",7,Plastics and articles thereof; rubber and articles thereof,48.39,8.949149410859898e-7
2021,398,391530,"Vinyl chloride polymers: waste, parings and scrap",7,Plastics and articles thereof; rubber and articles thereof,10.227,1.8913608395301545e-7
2021,398,391590,"Plastics n.e.s. in heading no. 3915: waste, parings and scrap",7,Plastics and articles thereof; rubber and articles thereof,1471.471,2.7213089135663204e-5
2021,398,391610,"Ethylene polymers: monofilament, of which any cross-sectional dimension exceeds 1mm, rods, sticks and profile shapes, whether or not surface-worked but not otherwise worked",7,Plastics and articles thereof; rubber and articles thereof,6.036999999999999,1.116470654956834e-7
2021,398,391620,"Vinyl chloride polymers: monofilament, of which any cross-sectional dimension exceeds 1mm, rods, sticks and profile shapes, whether or not surface-worked but not otherwise worked",7,Plastics and articles thereof; rubber and articles thereof,2346.7180000000003,4.339973136423707e-5
2021,398,391690,"Plastics: monofilament, of plastics n.e.s. in heading no. 3916, cross-sectional dimension exceeds 1mm, rods, sticks and profile shapes, whether or not surface-worked but not otherwise worked",7,Plastics and articles thereof; rubber and articles thereof,1168.321,2.160669392197819e-5
2021,398,391710,Plastics: artificial guts (sausage casings) of hardened protein or of cellulosic materials,7,Plastics and articles thereof; rubber and articles thereof,30.061,5.559420963832597e-7
2021,398,391721,"Plastics: tubes, pipes and hoses thereof, rigid, of polymers of ethylene",7,Plastics and articles thereof; rubber and articles thereof,3932.819,7.273276469697998e-5
2021,398,391722,"Plastics: tubes, pipes and hoses thereof, rigid, of polymers of propylene",7,Plastics and articles thereof; rubber and articles thereof,51.334,9.493606857968217e-7
2021,398,391723,"Plastics: tubes, pipes and hoses thereof, rigid, of polymers of vinyl chloride",7,Plastics and articles thereof; rubber and articles thereof,820.667,1.5177250670721555e-5
2021,398,391729,"Plastics: tubes, pipes and hoses thereof, rigid, of plastics n.e.s. in heading no. 3917",7,Plastics and articles thereof; rubber and articles thereof,123.047,2.275606504563087e-6
2021,398,391731,"Plastics: tubes, pipes and hoses thereof, flexible, having a minimum burst pressure of 27.6MPa",7,Plastics and articles thereof; rubber and articles thereof,0.9169999999999999,1.6958813824671472e-8
2021,398,391732,"Plastics: tubes, pipes and hoses thereof, other than those of item no. 3917.31, not reinforced or otherwise combined with other materials, without fittings",7,Plastics and articles thereof; rubber and articles thereof,342.232,6.3291698722409685e-6
2021,398,391733,"Plastics: tubes, pipes and hoses thereof, other than those of item no. 3917.31, not reinforced or otherwise combined with other materials, with fittings",7,Plastics and articles thereof; rubber and articles thereof,1284.391,2.3753269189840372e-5
2021,398,391739,"Plastics: tubes, pipes and hoses thereof, n.e.s. in item no. 3917.30",7,Plastics and articles thereof; rubber and articles thereof,309.34399999999994,5.720945805647951e-6
2021,398,391740,"Plastics: tube, pipe and hose fittings (eg joints, elbows, flanges)",7,Plastics and articles thereof; rubber and articles thereof,638.105,1.1800985709478725e-5
2021,398,391810,"Floor, wall or ceiling coverings: of polymers of vinyl chloride, whether or not self-adhesive, in rolls or in the form of tiles",7,Plastics and articles thereof; rubber and articles thereof,302.32699999999994,5.591174816980863e-6
2021,398,391890,"Floor, wall or ceiling coverings: of plastics (excluding polymers of vinyl chloride), whether or not self-adhesive, in rolls or in the form of tiles",7,Plastics and articles thereof; rubber and articles thereof,231.143,4.2747122179673265e-6
2021,398,391910,"Plastics: plates, sheets, film, foil, tape, strip, other flat shapes thereof, self-adhesive, in rolls of a width not exceeding 20cm",7,Plastics and articles thereof; rubber and articles thereof,119.822,2.2159640022898425e-6
2021,398,391990,"Plastics: plates, sheets, film, foil, tape, strip, other flat shapes thereof, self-adhesive, other than in rolls of a width not exceeding 20cm",7,Plastics and articles thereof; rubber and articles thereof,606.172,1.1210423221078252e-5
2021,398,392010,"Plastics: plates, sheets, film, foil and strip, of polymers of ethylene, non-cellular and not reinforced, laminated, supported or similarly combined with other materials",7,Plastics and articles thereof; rubber and articles thereof,1999.812,3.698412147474799e-5
2021,398,392020,"Plastics: of polymers of propylene, plates, sheets, film, foil and strip, non-cellular and not reinforced, laminated, supported or similarly combined with other materials",7,Plastics and articles thereof; rubber and articles thereof,19069.68,3.52670831860481e-4
2021,398,392030,"Plastics: of polymers of styrene, plates, sheets, film, foil and strip, non-cellular and not reinforced, laminated, supported or similarly combined with other materials",7,Plastics and articles thereof; rubber and articles thereof,13.67,2.528102344419401e-7
2021,398,392043,"Plastics: polymers of vinyl chloride, containing by weight not less than 6% of plasticisers: plates, sheets, film, foil and strip, non-cellular and not reinforced, laminated, supported or similarly combined with other materials",7,Plastics and articles thereof; rubber and articles thereof,87.491,1.61804098182588e-6
2021,398,392049,"Plastics: polymers of vinyl chloride,containing by weight, less than 6% of plasticisers: plates, sheets, film, foil and strip, non-cellular and not reinforced, laminated, supported or similarly combined with other materials",7,Plastics and articles thereof; rubber and articles thereof,31.738999999999997,5.869746913645015e-7
2021,398,392051,"Plastics: of acrylic polymers, polymethyl methacrylate, plates, sheets, film, foil and strip, non-cellular and not reinforced, laminated, supported or similarly combined with other materials",7,Plastics and articles thereof; rubber and articles thereof,299.293,5.5350646303461286e-6
2021,398,392059,"Plastics: of acrylic polymers (excluding polymethyl methacrylate), plates, sheets, film, foil and strip, non-cellular and not reinforced, laminated, supported or similarly combined with other materials",7,Plastics and articles thereof; rubber and articles thereof,8.029,1.484867134114365e-7
2021,398,392062,"Plastics: plates, sheets, film, foil and strip, of poly(ethylene terephthalate), non-cellular and not reinforced, laminated, supported or similarly combined with other materials",7,Plastics and articles thereof; rubber and articles thereof,10.850000000000001,2.0065772082626556e-7
2021,398,392069,"Plastics: plates, sheets, film, foil and strip, of polyesters n.e.s. in heading no. 3920, non-cellular and not reinforced, laminated, supported or similarly combined with other materials",7,Plastics and articles thereof; rubber and articles thereof,11.555,2.1369584923018416e-7
2021,398,392094,"Plastics: plates, sheets, film, foil and strip, of phenolic resins, non-cellular and not reinforced, laminated, supported or similarly combined with other materials",7,Plastics and articles thereof; rubber and articles thereof,0.061,1.1281217484241657e-9
2021,398,392099,"Plastics: plates, sheets, film, foil and strip, of plastics n.e.s. in heading no. 3920, non-cellular and not reinforced, laminated, supported or similarly combined with other materials",7,Plastics and articles thereof; rubber and articles thereof,39.955,7.389197452178285e-7
2021,398,392111,"Plastics: plates, sheets, film, foil and strip, of polymers of styrene, cellular",7,Plastics and articles thereof; rubber and articles thereof,6977.806,1.2904614270302676e-4
2021,398,392112,"Plastics: plates, sheets, film, foil and strip, of polymers of vinyl chloride, cellular",7,Plastics and articles thereof; rubber and articles thereof,605.532,1.1198587189619377e-5
2021,398,392113,"Plastics: plates, sheets, film, foil and strip, of polyurethanes, cellular",7,Plastics and articles thereof; rubber and articles thereof,21398.697,3.957432044858844e-4
2021,398,392119,"Plastics: plates, sheets, film, foil and strip, of plastics n.e.s. in heading no. 3921, cellular",7,Plastics and articles thereof; rubber and articles thereof,11.188999999999998,2.0692711873963914e-7
2021,398,392190,"Plastics: plates, sheets, film, foil and strip, other than cellular",7,Plastics and articles thereof; rubber and articles thereof,222.65099999999998,4.117662875547359e-6
2021,398,392210,"Plastics: baths, shower-baths, sinks and wash-basins",7,Plastics and articles thereof; rubber and articles thereof,66.509,1.230004087966276e-6
2021,398,392220,Plastics: lavatory seats and covers,7,Plastics and articles thereof; rubber and articles thereof,3.4640000000000004,6.406252027116902e-8
2021,398,392290,"Plastics: bidets, lavatory pans, flushing cisterns and similar sanitary ware n.e.s. in heading no. 3922",7,Plastics and articles thereof; rubber and articles thereof,6.676,1.2346460315540542e-7
2021,398,392310,"Plastics: boxes, cases, crates and similar articles for the conveyance or packing of goods",7,Plastics and articles thereof; rubber and articles thereof,89.012,1.646170050339866e-6
2021,398,392321,"Ethylene polymers: sacks and bags (including cones), for the conveyance or packing of goods",7,Plastics and articles thereof; rubber and articles thereof,94.886,1.7548026265733669e-6
2021,398,392329,"Plastics: sacks and bags (including cones), for the conveyance or packing of goods, of plastics other than ethylene polymers",7,Plastics and articles thereof; rubber and articles thereof,342.37299999999993,6.331777497921751e-6
2021,398,392330,"Plastics: carboys, bottles, flasks and similar articles, for the conveyance or packing of goods",7,Plastics and articles thereof; rubber and articles thereof,9302.38,1.720363473787867e-4
2021,398,392340,"Plastics: spools, cops, bobbins and similar supports, for the conveyance or packing of goods",7,Plastics and articles thereof; rubber and articles thereof,0.075,1.3870349365870888e-9
2021,398,392350,"Plastics: stoppers, lids, caps and other closures, for the conveyance or packing of goods",7,Plastics and articles thereof; rubber and articles thereof,11088.079,2.0506070603516842e-4
2021,398,392390,Plastics: articles for the conveyance or packing of goods n.e.s. in heading no. 3923,7,Plastics and articles thereof; rubber and articles thereof,882.184,1.6314933713308592e-5
2021,398,392410,Plastics: tableware and kitchenware,7,Plastics and articles thereof; rubber and articles thereof,339.65100000000007,6.2814373766232195e-6
2021,398,392490,Plastics: household and toilet articles,7,Plastics and articles thereof; rubber and articles thereof,323.178,5.97678902315123e-6
2021,398,392510,"Plastics: builders' ware, reservoirs, tanks, vats and similar containers of a capacity exceeding 300 litres",7,Plastics and articles thereof; rubber and articles thereof,143.644,2.656523285748211e-6
2021,398,392520,"Plastics: builders' ware, doors, windows and their frames and thresholds for doors",7,Plastics and articles thereof; rubber and articles thereof,15.483,2.8633949230903867e-7
2021,398,392530,"Plastics: builders' ware, shutters, blinds (including venetian blinds) and similar articles and parts thereof",7,Plastics and articles thereof; rubber and articles thereof,8.838000000000001,1.6344819692742259e-7
2021,398,392590,"Plastics: builders' ware, n.e.s. or included in heading no. 3925",7,Plastics and articles thereof; rubber and articles thereof,1978.561,3.659110974891583e-5
2021,398,392610,Plastics: office or school supplies,7,Plastics and articles thereof; rubber and articles thereof,5.219,9.651913778730691e-8
2021,398,392620,"Plastics: articles of apparel and clothing accessories (including gloves, mittens and mitts)",7,Plastics and articles thereof; rubber and articles thereof,62.673,1.1590618744096351e-6
2021,398,392630,"Plastics: fittings for furniture, coachwork or the like",7,Plastics and articles thereof; rubber and articles thereof,64.92099999999999,1.2006359349089385e-6
2021,398,392640,Plastics: statuettes and other ornamental articles,7,Plastics and articles thereof; rubber and articles thereof,42.501,7.860049578651715e-7
2021,398,392690,Plastics: other articles n.e.s. in chapter 39,7,Plastics and articles thereof; rubber and articles thereof,6142.8499999999995,1.1360463413618664e-4
2021,398,400110,"Rubber: natural rubber latex, whether or not pre-vulcanised, in primary forms or in plates, sheets or strip",7,Plastics and articles thereof; rubber and articles thereof,5.301,9.803562931797545e-8
2021,398,400129,"Rubber: natural (excluding latex, technically specified natural rubber and smoked sheets), in primary forms or in plates, sheets or strip",7,Plastics and articles thereof; rubber and articles thereof,1.026,1.8974637932511376e-8
2021,398,400211,"Rubber: synthetic, styrene-butadiene rubber (SBR) and carboxylated styrene-butadiene rubber (XSBR) latex, in primary forms or in plates, sheets or strip",7,Plastics and articles thereof; rubber and articles thereof,2.009,3.7154042501379484e-8
2021,398,400231,"Rubber: synthetic, isobutene-isoprene (butyl) rubber (IIR), in primary forms or in plates, sheets or strip",7,Plastics and articles thereof; rubber and articles thereof,0.039,7.212581670252862e-10
2021,398,400259,"Rubber: synthetic, acrylonitrile-butadiene rubber (NBR), (other than latex), in primary forms or in plates, sheets or strip",7,Plastics and articles thereof; rubber and articles thereof,39.622,7.327613100993818e-7
2021,398,400299,"Rubber: n.e.s. in chapter 40, (other than latex), in primary forms or in plates, sheets or strip",7,Plastics and articles thereof; rubber and articles thereof,5.019,9.2820377956407993e-08
2021,398,400400,"Rubber: waste, parings and scrap of rubber (other than hard rubber) and powders and granules obtained therefrom",7,Plastics and articles thereof; rubber and articles thereof,19.632,3.6307026500103644e-7
2021,398,400510,"Rubber: unvulcanised, compounded with carbon black or silica, in primary forms or in plates, sheets or strip",7,Plastics and articles thereof; rubber and articles thereof,4.627,8.557080868784614e-8
2021,398,400520,"Rubber: unvulcanised, compounded, solutions and dispersions other than those of item no. 4005.10",7,Plastics and articles thereof; rubber and articles thereof,0.086,1.5904667272865284e-9
2021,398,400591,"Rubber: unvulcanised, (compounded other than with carbon black or silica), in plates, sheets and strip",7,Plastics and articles thereof; rubber and articles thereof,16.368,3.0270650456076626e-7
2021,398,400599,"Rubber: unvulcanised, (compounded other than with carbon black or silica), in primary forms, (other than plates, sheets, strip, solutions or dispersions)",7,Plastics and articles thereof; rubber and articles thereof,10.1,1.8678737146039463e-7
2021,398,400610,"Rubber: unvulcanised, camel-back strips for retreading rubber tyres",7,Plastics and articles thereof; rubber and articles thereof,0.004,7.397519661797807e-11
2021,398,400690,"Rubber: unvulcanised, other than camel back strips for retreading rubber tyres",7,Plastics and articles thereof; rubber and articles thereof,8.129,1.5033609332688595e-7
2021,398,400700,"Rubber: vulcanised, thread and cord",7,Plastics and articles thereof; rubber and articles thereof,0.409,7.563963854188257e-9
2021,398,400811,"Rubber: vulcanised (other than hard rubber), in plates, sheets and strip of cellular rubber",7,Plastics and articles thereof; rubber and articles thereof,8.971,1.6590787221497034e-7
2021,398,400821,"Rubber: vulcanised (other than hard rubber), in plates, sheets and strip, of non-cellular rubber",7,Plastics and articles thereof; rubber and articles thereof,390.94800000000004,7.230113791851324e-6
2021,398,400829,"Rubber: vulcanised (other than hard rubber), non-cellular rubber, in forms other than plates, sheets or strip",7,Plastics and articles thereof; rubber and articles thereof,66.52600000000001,1.2303184825519025e-6
2021,398,400911,"Rubber: vulcanised (other than hard rubber), tubing, piping and hoses, not reinforced or otherwise combined with other materials, without fittings",7,Plastics and articles thereof; rubber and articles thereof,43.016,7.955292644297362e-7
2021,398,400912,"Rubber: vulcanised (other than hard rubber), tubing, piping and hoses, not reinforced or otherwise combined with other materials, with fittings",7,Plastics and articles thereof; rubber and articles thereof,18.056,3.3392403753355304e-7
2021,398,400921,"Rubber: vulcanised (other than hard rubber), tubing, piping and hoses, reinforced or otherwise combined only with metal, without fittings",7,Plastics and articles thereof; rubber and articles thereof,159.609,2.9517767892497157e-6
2021,398,400922,"Rubber: vulcanised (other than hard rubber), tubing, piping and hoses, reinforced or otherwise combined only with metal, with fittings",7,Plastics and articles thereof; rubber and articles thereof,363.011,6.7134525248722105e-6
2021,398,400931,"Rubber: vulcanised (other than hard rubber), tubing, piping and hoses, reinforced or otherwise combined only with textile materials, without fittings",7,Plastics and articles thereof; rubber and articles thereof,87.69500000000001,1.621813716853397e-6
2021,398,400932,"Rubber: vulcanised (other than hard rubber), tubing, piping and hoses, reinforced or otherwise combined only with textile materials, with fittings",7,Plastics and articles thereof; rubber and articles thereof,192.28300000000002,3.5560431828236697e-6
2021,398,400941,"Rubber: vulcanised (other than hard rubber), tubing, piping and hoses, reinforced or otherwise combined with materials other than metal or textiles, without fittings",7,Plastics and articles thereof; rubber and articles thereof,137.393,2.5409185472334653e-6
2021,398,400942,"Rubber: vulcanised (other than hard rubber), tubing, piping and hoses, reinforced or otherwise combined with materials other than metal or textiles, with fittings",7,Plastics and articles thereof; rubber and articles thereof,47.307,8.748861566016722e-7
2021,398,401012,"Rubber: vulcanised, conveyor belts or belting, reinforced only with textile materials",7,Plastics and articles thereof; rubber and articles thereof,81.48599999999999,1.50698571790314e-6
2021,398,401019,"Rubber: vulcanised, conveyor belts or belting, (reinforced with other than metal only, textile materials only or plastics only)",7,Plastics and articles thereof; rubber and articles thereof,127.25300000000001,2.3533914238068913e-6
2021,398,401031,"Rubber: vulcanised, endless transmission belts of trapezoidal cross-section (V-belts), V-ribbed, of an outside circumference exceeding 60cm but not exceeding 180 cm",7,Plastics and articles thereof; rubber and articles thereof,33.37,6.171380777854821e-7
2021,398,401032,"Rubber: vulcanised, endless transmission belts of trapezoidal cross-section (V-belts), other than V-ribbed, of an outside circumference exceeding 60cm but not exceeding 180 cm",7,Plastics and articles thereof; rubber and articles thereof,56.81999999999999,1.0508176679583784e-6
2021,398,401033,"Rubber: vulcanised, endless transmission belts of trapezoidal cross-section (V-belts), V-ribbed, of an outside circumference exceeding 180cm but not exceeding 240 cm",7,Plastics and articles thereof; rubber and articles thereof,18.339,3.39157782694275e-7
2021,398,401034,"Rubber: vulcanised, endless transmission belts of trapezoidal cross-section (V-belts), other than V-ribbed, of an outside circumference exceeding 180cm but not exceeding 240 cm",7,Plastics and articles thereof; rubber and articles thereof,22.392000000000003,4.141131506674413e-7
2021,398,401035,"Rubber: vulcanised, endless synchronous belts, of an outside circumference exceeding 60 cm but not exceeding 150 cm",7,Plastics and articles thereof; rubber and articles thereof,31.490000000000002,5.823697353750325e-7
2021,398,401036,"Rubber: vulcanised, endless synchronous belts, of an outside circumference exceeding 150 cm but not exceeding 198 cm",7,Plastics and articles thereof; rubber and articles thereof,3.859,7.136757093719435e-8
2021,398,401039,"Rubber: vulcanised, conveyor or transmission belts or belting, n.e.c. in heading no. 4010",7,Plastics and articles thereof; rubber and articles thereof,177.821,3.2885858594513697e-6
2021,398,401110,"Rubber: new pneumatic tyres, of a kind used on motor cars (including station wagons and racing cars)",7,Plastics and articles thereof; rubber and articles thereof,2582.375,4.7757924591587785e-5
2021,398,401120,"Rubber: new pneumatic tyres, of a kind used on buses or lorries",7,Plastics and articles thereof; rubber and articles thereof,1224.6639999999998,2.2648690047739873e-5
2021,398,401130,"Rubber: new pneumatic tyres, of a kind used on aircraft",7,Plastics and articles thereof; rubber and articles thereof,1.1,2.0343179069943974e-8
2021,398,401150,"Rubber: new pneumatic tyres, of a kind used on bicycles",7,Plastics and articles thereof; rubber and articles thereof,0.029,5.363201754803411e-10
2021,398,401161,"Rubber: new pneumatic tyres having a herring-bone or similar tread, of a kind used on agricultural or forestry vehicles and machines",7,Plastics and articles thereof; rubber and articles thereof,31.16,5.762667816540492e-7
2021,398,401194,"Rubber: new pneumatic tyres having other than a herring-bone or similar tread, of a kind used on construction or industrial handling vehicles and machines and having a rim size exceeding 61cm",7,Plastics and articles thereof; rubber and articles thereof,610.581,1.1291962381550418e-5
2021,398,401199,"Rubber: new pneumatic tyres having other than a herring-bone or similar tread, of a kind used on light industrial vehicles",7,Plastics and articles thereof; rubber and articles thereof,60.657,1.121778375314174e-6
2021,398,401212,Retreaded tyres: of a kind used on motor buses or lorries,7,Plastics and articles thereof; rubber and articles thereof,1.994,3.687663551406207e-8
2021,398,401220,Rubber: used pneumatic tyres,7,Plastics and articles thereof; rubber and articles thereof,30.056,5.558496273874873e-7
2021,398,401290,Rubber: tyres n.e.s. in heading no. 4012,7,Plastics and articles thereof; rubber and articles thereof,21.033,3.889800776164832e-7
2021,398,401310,"Rubber: inner tubes, of a kind used on motorcars (including station wagons and racing cars), buses and lorries",7,Plastics and articles thereof; rubber and articles thereof,0.026,4.808387780168574e-10
2021,398,401320,"Rubber: inner tubes, of a kind used on bicycles",7,Plastics and articles thereof; rubber and articles thereof,3.967,7.336490124587976e-8
2021,398,401390,"Rubber: inner tubes, n.e.s. in heading no. 4013",7,Plastics and articles thereof; rubber and articles thereof,17.871000000000002,3.305026846899716e-7
2021,398,401410,"Rubber: vulcanised (other than hard rubber), sheath contraceptives",7,Plastics and articles thereof; rubber and articles thereof,66.574,1.231206184911318e-6
