2021,398,650700,"Head-bands, linings, covers, hat foundations, hat frames, peaks and chinstraps: for headgear",12,"Footwear, headgear, umbrellas, sun umbrellas, walking-sticks, seat-sticks, whips, riding-crops and parts thereof; prepared feathers and articles made therewith; artificial flowers; articles of human hair",427.215,7.900828405787375e-6
2021,398,660191,"Umbrellas and sun umbrellas: having a telescopic shaft, (excluding garden or similar umbrellas)",12,"Footwear, headgear, umbrellas, sun umbrellas, walking-sticks, seat-sticks, whips, riding-crops and parts thereof; prepared feathers and articles made therewith; artificial flowers; articles of human hair",12.68,2.345013732789905e-7
2021,398,660199,Umbrellas and sun umbrellas: n.e.s. in heading no. 6601 (including walking stick umbrellas),12,"Footwear, headgear, umbrellas, sun umbrellas, walking-sticks, seat-sticks, whips, riding-crops and parts thereof; prepared feathers and articles made therewith; artificial flowers; articles of human hair",18.244,3.37400871774598e-7
2021,398,660200,"Walking-sticks, seat-sticks, whips, riding-crops and the like",12,"Footwear, headgear, umbrellas, sun umbrellas, walking-sticks, seat-sticks, whips, riding-crops and parts thereof; prepared feathers and articles made therewith; artificial flowers; articles of human hair",2.647,4.895308636194699e-8
2021,398,670100,"Skins and other parts of birds with their feathers or down: feathers, parts of feathers, down and articles thereof (other than goods of heading no. 0505 and worked quills and scapes)",12,"Footwear, headgear, umbrellas, sun umbrellas, walking-sticks, seat-sticks, whips, riding-crops and parts thereof; prepared feathers and articles made therewith; artificial flowers; articles of human hair",0.095,1.7569109196769794e-9
2021,398,670210,"Flowers, foliage and fruit, artificial, and parts thereof: articles made of artificial flowers, foliage or fruit, of plastics",12,"Footwear, headgear, umbrellas, sun umbrellas, walking-sticks, seat-sticks, whips, riding-crops and parts thereof; prepared feathers and articles made therewith; artificial flowers; articles of human hair",24.193,4.474204829446859e-7
2021,398,670419,"False beards, eyebrows and eyelashes, switches and the like: of synthetic textile materials",12,"Footwear, headgear, umbrellas, sun umbrellas, walking-sticks, seat-sticks, whips, riding-crops and parts thereof; prepared feathers and articles made therewith; artificial flowers; articles of human hair",0.592,1.0948329099460755e-8
2021,398,670420,"Wigs, false beards, eyebrows and eyelashes, switches and the like and other articles n.e.s.: of human hair",12,"Footwear, headgear, umbrellas, sun umbrellas, walking-sticks, seat-sticks, whips, riding-crops and parts thereof; prepared feathers and articles made therewith; artificial flowers; articles of human hair",65.106,1.20405728775252e-6
2021,398,670490,"Wigs, false beards, eyebrows and eyelashes, switches and the like and other articles n.e.s.: of animal hair or of textile materials other than synthetic",12,"Footwear, headgear, umbrellas, sun umbrellas, walking-sticks, seat-sticks, whips, riding-crops and parts thereof; prepared feathers and articles made therewith; artificial flowers; articles of human hair",0.119,2.2007620993848477e-9
2021,398,680100,"Stone: setts, curbstones and flagstones, of natural stone (except slate)",13,"Articles of stone, plaster, cement, asbestos, mica or similar materials; ceramic products; glass and glassware",306.432,5.6670918625100644e-6
2021,398,680221,"Marble, travertine and alabaster: simply cut or sawn, with a flat or even surface",13,"Articles of stone, plaster, cement, asbestos, mica or similar materials; ceramic products; glass and glassware",35.150999999999996,6.500755340796368e-7
2021,398,680223,"Granite: articles thereof, simply cut or sawn, with a flat or even surface",13,"Articles of stone, plaster, cement, asbestos, mica or similar materials; ceramic products; glass and glassware",742.3420000000001,1.3728723851945771e-5
2021,398,680229,"Stone: monumental or building stone, n.e.s. in item no. 6802.2, articles thereof, simply cut or sawn, with a flat or even surface",13,"Articles of stone, plaster, cement, asbestos, mica or similar materials; ceramic products; glass and glassware",78.34100000000001,1.4488227195622553e-6
2021,398,680291,"Marble, travertine and alabaster: articles thereof, (other than simply cut or sawn, with a flat or even surface)",13,"Articles of stone, plaster, cement, asbestos, mica or similar materials; ceramic products; glass and glassware",53.621,9.916560044631507e-7
2021,398,680293,"Granite: articles thereof, (other than simply cut or sawn, with a flat or even surface)",13,"Articles of stone, plaster, cement, asbestos, mica or similar materials; ceramic products; glass and glassware",359.912,6.656140241292431e-6
2021,398,680299,"Stone: natural (excluding marble, travertine, alabaster, other calcareous stone or granite), monumental or building stone, (other than simply cut or sawn, with a flat or even surface)",13,"Articles of stone, plaster, cement, asbestos, mica or similar materials; ceramic products; glass and glassware",0.277,5.122782365794982e-9
2021,398,680410,"Millstones and grindstones: for milling, grinding or pulping",13,"Articles of stone, plaster, cement, asbestos, mica or similar materials; ceramic products; glass and glassware",2.8779999999999997,5.322515396663522e-8
2021,398,680421,"Millstones, grindstones, grinding wheels and the like: of agglomerated synthetic or natural diamond",13,"Articles of stone, plaster, cement, asbestos, mica or similar materials; ceramic products; glass and glassware",11.935,2.207234929088921e-7
2021,398,680422,"Millstones, grindstones, grinding wheels and the like: of other agglomerated abrasives or of ceramics",13,"Articles of stone, plaster, cement, asbestos, mica or similar materials; ceramic products; glass and glassware",44.679,8.262844524236606e-7
2021,398,680430,"Stones: hand sharpening or polishing stones, of natural stone, agglomerated natural or artificial abrasives or ceramics, with or without parts of other materials",13,"Articles of stone, plaster, cement, asbestos, mica or similar materials; ceramic products; glass and glassware",4.933,9.122991122912146e-8
2021,398,680510,"Abrasive powder or grain: natural or artificial, on a base of woven textile fabric only, whether or not cut to shape or sewn or otherwise made up",13,"Articles of stone, plaster, cement, asbestos, mica or similar materials; ceramic products; glass and glassware",3.0500000000000003,5.640608742120829e-8
2021,398,680520,"Abrasive powder or grain: natural or artificial, on a base of paper or paperboard only, whether or not cut to shape or sewn or otherwise made up",13,"Articles of stone, plaster, cement, asbestos, mica or similar materials; ceramic products; glass and glassware",11.499,2.1266019647753248e-7
2021,398,680530,"Abrasive powder or grain: natural or artificial, on a base of materials n.e.s. in heading no. 6805, whether or not cut to shape or sewn or otherwise made up",13,"Articles of stone, plaster, cement, asbestos, mica or similar materials; ceramic products; glass and glassware",17.065,3.15596682571449e-7
2021,398,680610,"Slag wool, rock wool and similar mineral wools (including intermixtures thereof), in bulk, sheets or rolls",13,"Articles of stone, plaster, cement, asbestos, mica or similar materials; ceramic products; glass and glassware",7884.753000000001,1.4581903836479812e-4
2021,398,680620,"Exfoliated vermiculite, expanded clays, foamed slag and similar expanded mineral materials (including intermixtures thereof)",13,"Articles of stone, plaster, cement, asbestos, mica or similar materials; ceramic products; glass and glassware",12364.449,2.286656364619906e-4
2021,398,680690,"Minerals: mixtures and articles of heat-insulating, sound-insulating or sound-absorbing mineral materials, other than those of heading no. 6811 or 6812 or of chapter 69",13,"Articles of stone, plaster, cement, asbestos, mica or similar materials; ceramic products; glass and glassware",113.591,2.100729139758187e-6
2021,398,680710,Asphalt or similar material: articles (eg petroleum bitumen or coal tar pitch) in rolls,13,"Articles of stone, plaster, cement, asbestos, mica or similar materials; ceramic products; glass and glassware",587.8,1.0870655143011877e-5
2021,398,680790,Asphalt or similar material: articles (eg petroleum bitumen or coal tar pitch) other than in rolls,13,"Articles of stone, plaster, cement, asbestos, mica or similar materials; ceramic products; glass and glassware",167.148,3.0912015410754496e-6
2021,398,680800,"Panels, boards, tiles, blocks and the like: of vegetable fibre, of straw, shavings, chips, particles, sawdust or other waste, of wood, agglomerated with cement, plaster or other mineral binders",13,"Articles of stone, plaster, cement, asbestos, mica or similar materials; ceramic products; glass and glassware",16.892,3.123972553177214e-7
2021,398,680911,"Plaster, or plaster compositions: boards, sheets, panels, tiles and similar articles, faced or reinforced with paper or paperboard only, not ornamented",13,"Articles of stone, plaster, cement, asbestos, mica or similar materials; ceramic products; glass and glassware",3800.4179999999997,7.028416719512574e-5
2021,398,680919,"Plaster, or plaster compositions: boards, sheets, panels, tiles and similar articles, (other than faced or reinforced with paper or paperboard only), not ornamented",13,"Articles of stone, plaster, cement, asbestos, mica or similar materials; ceramic products; glass and glassware",6.821000000000001,1.2614620403280712e-7
2021,398,680990,Plaster articles or articles of compositions based on plaster: n.e.s. in heading no. 6809,13,"Articles of stone, plaster, cement, asbestos, mica or similar materials; ceramic products; glass and glassware",0.433,8.007815033896126e-9
2021,398,681011,"Cement, concrete or artificial stone: building blocks or bricks, whether or not reinforced",13,"Articles of stone, plaster, cement, asbestos, mica or similar materials; ceramic products; glass and glassware",1038.328,1.9202629488487984e-5
2021,398,681019,"Cement, concrete or artificial stone: tiles, flagstones and similar, (excluding building blocks and bricks) whether or not reinforced",13,"Articles of stone, plaster, cement, asbestos, mica or similar materials; ceramic products; glass and glassware",269.492,4.983930921743037e-6
2021,398,681091,"Cement, concrete or artificial stone: prefabricated structural components for building or civil engineering, whether or not reinforced",13,"Articles of stone, plaster, cement, asbestos, mica or similar materials; ceramic products; glass and glassware",3.636,6.724345372574207e-8
2021,398,681099,"Cement, concrete or artificial stone: articles (other than prefabricated structural components for building or civil engineering), whether or not reinforced, n.e.s. in heading no. 6810",13,"Articles of stone, plaster, cement, asbestos, mica or similar materials; ceramic products; glass and glassware",1113.469,2.0592272050755857e-5
2021,398,681110,"Asbestos-cement, cellulose fibre-cement articles or the like: corrugated sheets",13,"Articles of stone, plaster, cement, asbestos, mica or similar materials; ceramic products; glass and glassware",6.369,1.1778700681497559e-7
2021,398,681120,"Asbestos-cement, cellulose fibre-cement articles or the like: sheets, panels, tiles and similar articles, other than corrugated sheets",13,"Articles of stone, plaster, cement, asbestos, mica or similar materials; ceramic products; glass and glassware",23.31,4.310904582912672e-7
2021,398,681190,"Asbestos-cement, cellulose fibre-cement articles or the like: articles n.e.s. in heading no. 6811",13,"Articles of stone, plaster, cement, asbestos, mica or similar materials; ceramic products; glass and glassware",2090.32,3.865795824862299e-5
2021,398,681260,"Asbestos: paper, millboard and felt, of a mixture with a basis of asbestos or asbestos and magnesium carbonate, whether or not reinforced (excluding goods of heading no. 6811 or 6813)",13,"Articles of stone, plaster, cement, asbestos, mica or similar materials; ceramic products; glass and glassware",31.144000000000002,5.759708808675773e-7
2021,398,681270,"Asbestos fibres, fabricated: compressed asbestos fibre jointing, in sheets or rolls",13,"Articles of stone, plaster, cement, asbestos, mica or similar materials; ceramic products; glass and glassware",31.355,5.798730724891756e-7
2021,398,681290,"Asbestos: goods n.e.s. in heading no. 6812, of a mixture with a basis of asbestos and magnesium carbonate, whether or not reinforced (excluding goods of heading no. 6811 or 6813)",13,"Articles of stone, plaster, cement, asbestos, mica or similar materials; ceramic products; glass and glassware",124.02199999999999,2.2936379587387192e-6
2021,398,681310,"Brake linings and pads: with a basis of asbestos, of other mineral substances or of cellulose",13,"Articles of stone, plaster, cement, asbestos, mica or similar materials; ceramic products; glass and glassware",1.1860000000000002,2.1933645797230503e-8
2021,398,681390,"Friction material: unmounted, for clutches or the like, with a basis of asbestos, of other mineral substances or of cellulose, other than brake linings and pads",13,"Articles of stone, plaster, cement, asbestos, mica or similar materials; ceramic products; glass and glassware",17.751,3.2828342879143224e-7
2021,398,681410,"Mica: plates, sheets and strips of agglomerated or reconstituted mica, whether or not on a support of paper, paperboard or other materials",13,"Articles of stone, plaster, cement, asbestos, mica or similar materials; ceramic products; glass and glassware",1205.986,2.230326286713223e-5
2021,398,681490,"Mica: worked mica and articles of mica (excluding plates, sheets and strips) whether or not on a support of paper, paperboard or other materials",13,"Articles of stone, plaster, cement, asbestos, mica or similar materials; ceramic products; glass and glassware",0.067,1.2390845433511328e-9
2021,398,681510,"Stone articles and other mineral substances, non-electrical articles of graphite or other carbon",13,"Articles of stone, plaster, cement, asbestos, mica or similar materials; ceramic products; glass and glassware",46.163,8.537292503689304e-7
2021,398,681599,Stone articles and articles of other mineral substances: n.e.s. or included in heading no. 6815,13,"Articles of stone, plaster, cement, asbestos, mica or similar materials; ceramic products; glass and glassware",55.608000000000004,1.0284031833831312e-6
2021,398,690220,"Refractory bricks, blocks, tiles and similar refractory ceramic constructional goods: containing by weight more than 50% of alumina (Al2o3), of silica (SiO2) or of a mixture or compound of these",13,"Articles of stone, plaster, cement, asbestos, mica or similar materials; ceramic products; glass and glassware",2117.137,3.915390646054907e-5
2021,398,690290,"Refractory bricks, blocks, tiles and similar refractory ceramic constructional goods: n.e.s. in item no. 6902.1 or 6902.2",13,"Articles of stone, plaster, cement, asbestos, mica or similar materials; ceramic products; glass and glassware",56.002,1.0356897402500021e-6
2021,398,690310,"Refractory ceramic goods: containing by weight more than 50% of graphite or other forms of carbon or of a mixture of these products, excluding those of siliceous fossil meals or similar earths",13,"Articles of stone, plaster, cement, asbestos, mica or similar materials; ceramic products; glass and glassware",0.474,8.766060799230401e-9
2021,398,690320,"Refractory ceramic goods: containing by weight more than 50% of alumina or of a mixture or compound of alumina and of silica, excluding those of siliceous fossil meals or similar earths",13,"Articles of stone, plaster, cement, asbestos, mica or similar materials; ceramic products; glass and glassware",33.069,6.115714442399793e-7
2021,398,690390,"Refractory ceramic goods: composition of which n.e.s. in heading no. 6903, other than those of siliceous fossil meals or similar earths",13,"Articles of stone, plaster, cement, asbestos, mica or similar materials; ceramic products; glass and glassware",111.148,2.0555487884237566e-6
2021,398,690410,Ceramic building bricks,13,"Articles of stone, plaster, cement, asbestos, mica or similar materials; ceramic products; glass and glassware",83.04599999999999,1.5358360445841517e-6
2021,398,690790,Ceramic flags and paving: unglazed,13,"Articles of stone, plaster, cement, asbestos, mica or similar materials; ceramic products; glass and glassware",1152.0810000000001,2.13063546237092e-5
2021,398,690810,"Ceramic tiles, cubes and similar articles: glazed, whether or not rectangular or on a backing, with the largest surface area less than a 7cm square",13,"Articles of stone, plaster, cement, asbestos, mica or similar materials; ceramic products; glass and glassware",20.824,3.851148735931939e-7
2021,398,690911,"Ceramic wares: for laboratory, chemical or other technical uses, of porcelain or china",13,"Articles of stone, plaster, cement, asbestos, mica or similar materials; ceramic products; glass and glassware",0.315,5.8255467336657734e-9
2021,398,690912,"Ceramic wares: for laboratory, chemical or other technical uses, articles having a hardness equivalent to 9 or more on the Mohs scale",13,"Articles of stone, plaster, cement, asbestos, mica or similar materials; ceramic products; glass and glassware",50.031000000000006,9.252632654985154e-7
2021,398,690919,"Ceramic wares: for laboratory, chemical or other technical uses, other than articles having a hardness equivalent to 9 or more on the Mohs scale or of porcelain or china",13,"Articles of stone, plaster, cement, asbestos, mica or similar materials; ceramic products; glass and glassware",168.075,3.108345292891666e-6
2021,398,690990,"Ceramic wares: pots, jars and similar articles of a kind used for the conveyance or packing of goods and ceramic troughs, tubs and similar receptacles used in agriculture",13,"Articles of stone, plaster, cement, asbestos, mica or similar materials; ceramic products; glass and glassware",0.615,1.137368648001413e-8
2021,398,691010,"Ceramic sinks, wash basins, wash basin pedestals, baths, bidets, water closet pans, flushing cisterns, urinals and similar sanitary fixtures: of porcelain or china",13,"Articles of stone, plaster, cement, asbestos, mica or similar materials; ceramic products; glass and glassware",4.880999999999999,9.026823367308774e-8
2021,398,691090,"Ceramic sinks, wash basins, wash basin pedestals, baths, bidets, water closet pans, flushing cisterns, urinals and similar sanitary fixtures: of other than porcelain or china",13,"Articles of stone, plaster, cement, asbestos, mica or similar materials; ceramic products; glass and glassware",37.854,7.000642731942355e-7
2021,398,691110,Tableware and kitchenware: of porcelain or china,13,"Articles of stone, plaster, cement, asbestos, mica or similar materials; ceramic products; glass and glassware",75.50000000000001,1.3962818361643365e-6
2021,398,691190,"Household and toilet articles: n.e.s. in heading no. 6911, of porcelain or china",13,"Articles of stone, plaster, cement, asbestos, mica or similar materials; ceramic products; glass and glassware",2.77,5.1227823657949816e-8
2021,398,691200,"Ceramic tableware, kitchenware, other household articles and toilet articles: other than of porcelain or china",13,"Articles of stone, plaster, cement, asbestos, mica or similar materials; ceramic products; glass and glassware",155.222,2.8706444923589486e-6
2021,398,691310,"Ceramic statuettes and other ornamental ceramic articles, of porcelain or china",13,"Articles of stone, plaster, cement, asbestos, mica or similar materials; ceramic products; glass and glassware",0.205,3.791228826671376e-9
2021,398,691390,Ceramic statuettes and other ornamental ceramic articles: other than of porcelain or china,13,"Articles of stone, plaster, cement, asbestos, mica or similar materials; ceramic products; glass and glassware",33.058,6.113680124492798e-7
2021,398,691410,Ceramic articles n.e.s. in chapter 69: of porcelain or china,13,"Articles of stone, plaster, cement, asbestos, mica or similar materials; ceramic products; glass and glassware",0.403,7.453001059261291e-9
2021,398,691490,Ceramic articles n.e.s. in chapter 69: other than of porcelain or china,13,"Articles of stone, plaster, cement, asbestos, mica or similar materials; ceramic products; glass and glassware",59.419,1.0988830519609098e-6
2021,398,700100,"Glass: cullet and other waste and scrap of glass, glass in the mass",13,"Articles of stone, plaster, cement, asbestos, mica or similar materials; ceramic products; glass and glassware",302.473,5.5938749116574205e-6
2021,398,700239,"Glass: unworked, in tubes, other than of glass having a linear coefficient of expansion not exceeding 5 x 10-6 per kelvin within a temperature range of 0-300 degrees C, not fused quartz or other fused silica",13,"Articles of stone, plaster, cement, asbestos, mica or similar materials; ceramic products; glass and glassware",2.1399999999999997,3.9576730190618264e-8
2021,398,700320,"Glass: cast glass and rolled glass, wired sheets, whether or not having an absorbent or reflecting layer but not otherwise worked",13,"Articles of stone, plaster, cement, asbestos, mica or similar materials; ceramic products; glass and glassware",0.178,3.291896249500024e-9
2021,398,700490,"Glass: drawn and blown, in sheets, (other than glass coloured throughout the mass (body tinted), opacified, flashed or having an absorbent, reflecting or non-reflecting layer)",13,"Articles of stone, plaster, cement, asbestos, mica or similar materials; ceramic products; glass and glassware",0.041,7.582457653342753e-10
2021,398,700510,"Glass: float glass and surface ground or polished glass, in sheets, non-wired, having an absorbent reflecting or non-reflecting layer",13,"Articles of stone, plaster, cement, asbestos, mica or similar materials; ceramic products; glass and glassware",16.457,3.043524526855163e-7
2021,398,700521,"Glass: float glass and surface ground or polished glass, in sheets, non-wired, coloured throughout the mass (body tinted), opacified, flashed or merely surface ground",13,"Articles of stone, plaster, cement, asbestos, mica or similar materials; ceramic products; glass and glassware",0.492,9.098949184011303e-9
2021,398,700529,"Glass: float glass and surface ground or polished glass, in sheets, non-wired, (other than coloured throughout the mass (body tinted), opacified, flashed or merely surface ground)",13,"Articles of stone, plaster, cement, asbestos, mica or similar materials; ceramic products; glass and glassware",2.279,4.214736827309301e-8
2021,398,700600,"Glass of heading no. 7003, 7004 or 7005: bent, edge-worked, engraved, drilled, enamelled or otherwise worked, but not framed or fitted with other materials",13,"Articles of stone, plaster, cement, asbestos, mica or similar materials; ceramic products; glass and glassware",0.302,5.585127344657345e-9
2021,398,700711,"Glass: safety glass, toughened (tempered), of size and shape suitable for incorporation in vehicles, aircraft, spacecraft or vessels",13,"Articles of stone, plaster, cement, asbestos, mica or similar materials; ceramic products; glass and glassware",28.423,5.256492533681976e-7
2021,398,700719,"Glass: safety glass, toughened (tempered), (not of a size and shape suitable for incorporation in vehicles, aircraft, spacecraft or vessels)",13,"Articles of stone, plaster, cement, asbestos, mica or similar materials; ceramic products; glass and glassware",261.029,4.8274178994985496e-06
2021,398,700721,"Glass: safety glass, laminated, of size and shape suitable for incorporation in vehicles, aircraft, spacecraft or vessels",13,"Articles of stone, plaster, cement, asbestos, mica or similar materials; ceramic products; glass and glassware",45.626999999999995,8.438165740221213e-7
2021,398,700729,"Glass: safety glass, laminated, (not of a size and shape suitable for incorporation in vehicles, aircraft, spacecraft or vessels)",13,"Articles of stone, plaster, cement, asbestos, mica or similar materials; ceramic products; glass and glassware",94.392,1.7456666897910467e-6
2021,398,700800,Glass: multiple-walled insulating units of glass,13,"Articles of stone, plaster, cement, asbestos, mica or similar materials; ceramic products; glass and glassware",1401.73,2.5923313088829604e-5
2021,398,700910,Glass: rear-view mirrors for vehicles,13,"Articles of stone, plaster, cement, asbestos, mica or similar materials; ceramic products; glass and glassware",38.439,7.108831456996148e-7
2021,398,700991,"Glass mirrors: unframed, excluding rear-view mirrors for vehicles",13,"Articles of stone, plaster, cement, asbestos, mica or similar materials; ceramic products; glass and glassware",1.203,2.2248040382856908e-8
2021,398,700992,"Glass mirrors: framed, excluding rear-view mirrors for vehicles",13,"Articles of stone, plaster, cement, asbestos, mica or similar materials; ceramic products; glass and glassware",53.922999999999995,9.972411318078079e-7
2021,398,701010,"Glass: ampoules, of a kind used for the conveyance or packing of goods",13,"Articles of stone, plaster, cement, asbestos, mica or similar materials; ceramic products; glass and glassware",4.12,7.619445251651742e-8
2021,398,701020,"Glass: stoppers, lids and other closures",13,"Articles of stone, plaster, cement, asbestos, mica or similar materials; ceramic products; glass and glassware",6.598000000000001,1.2202208682135485e-7
2021,398,701090,"Glass: carboys, bottles, flasks, jars, pots, phials and other containers of glass, (not ampoules), used for the conveyance or packing of goods",13,"Articles of stone, plaster, cement, asbestos, mica or similar materials; ceramic products; glass and glassware",1697.7220000000002,3.1397329688166745e-5
